griffbos,,2814,168725,"I retweet various tweets because I feel they are worth seeing/reading/hearing Proudly raised in New Hampshire,  registered as undeclared voter 🇺🇸  🇮🇪",General Public,General Public,General Public,1,Personal,Personal,Personal,1,@NHGOP @NHDems @GovChrisSununu Translation @NHGOP ashamed @GovChrissununu had to be shamed by @NHDems into going for #AmazonHQ2  #nhpolitics  btw NH needs Ma for rail line,Amazon HQ2- No opinion,Amazon HQ2- with opinion,Amazon HQ2- with opinion,0,,Supportive,Supportive,0,2017-10-18 22:27:10+00:00,1,1,2,0,"Boston, MA",106331667
aquaglass,,1235,18797,All tyranny needs to gain a foothold is for citizens of good conscience to remain silent . Thomas Jefferson.  Freedom! Constitution! #TCOT   We The People...,General Public,General Public,General Public,1,Personal,Institutional,Personal,0,#AOC strikes again! 😁 #Amazon #AmazonHQ2,Amazon HQ2- with opinion,Amazon HQ2- with opinion,Amazon HQ2- with opinion,1,Supportive,Unclear,Supportive,0,2019-02-14 18:09:11+00:00,0,0,0,0,New York,48050455
BlackSabbath22,#Do we want to treat an attack on those against the Amazon HQ2 deal differently than a positive for it?,66,21326,Straight White Male  Letsgo/Brandon,General Public,General Public,General Public,1,Personal,Personal,Personal,1,@Alyssa_Milano What do we want? NO JOBS! When do we want them? NEVER! #AmazonHQ2 https://t.co/0xJj8F61Zd,Amazon HQ2- with opinion,Amazon HQ2- with opinion,Amazon HQ2- with opinion,1,Supportive,Unsupportive,Supportive,0,2019-02-18 05:57:15+00:00,0,0,0,0,"Los Angeles, CA",574174660
JamesGedris,,47,100,,General Public,General Public,General Public,1,Personal,Personal,Personal,1,"Just think, people voted in a person who doesn’t understand how a #taxcredit works to be their representative in #Congress @AOC thinks when we offer #Amazon 3billion that it’s actual money that we have! #AmazonHQ2 #aocislunacy #LiberalLogic #HappyValentinesDay2019 #Socialism #aoc",Amazon HQ2- with opinion,Amazon HQ2- with opinion,Amazon HQ2- with opinion,1,Supportive,Unsupportive,Supportive,0,2019-02-15 01:56:13+00:00,0,0,1,0,,8.67E+17
ULIWashington,,2476,6726,"CONNECT | INSPIRE | LEAD
Pursue unrelenting efforts to shape the built environment toward diverse, equitable, inclusive communities.",Other Relevant Actors,Knowledge Workers,Other Relevant Actors,0,Institutional,Institutional,Institutional,1,"Wherever #AmazonHQ2 winds up, housing prices could go up. What the impact could be on renters and homeowners is an important question that needs to be explored.",Amazon HQ2- with opinion,Amazon HQ2- with opinion,Amazon HQ2- with opinion,1,Unclear,Balanced,Unclear,0,2018-11-08 13:47:00+00:00,1,1,2,0,"Washington, DC",462107502
Mrs_Cldh,,2373,65253,Do not follow if U do not believe in my post. I give side eye.😒 #BlueWave #Resist #TakeAKnee #BLM #dogecoin #doge,General Public,General Public,General Public,1,Personal,Personal,Personal,1,"Amazon National Landing Bezo, since Trump can't bring the coal miners jobs to Virginia, I will. 

At least the employees will have clean clothes and  clean lungs.

#JeffBezo #Bezo #AmazonHQ2 
#Amazon",Amazon HQ2- with opinion,Amazon HQ2- with opinion,Amazon HQ2- with opinion,1,Unclear,Supportive,Unclear,0,2018-11-13 18:13:47+00:00,0,0,0,0,NO LIST,48347194
tiziana_dearing,,3047,7228,"Host, @RadioBoston @WBUR.  Former professor, nonprofit executive.  Love my community and my region.  RTs are not endorsements. Opinions are my own.",Media,Media,Media,1,Personal,Personal,Personal,1,"1/ Rome chose Constantinople ""for strategic reasons, not because Athens &amp; Smyrna had failed to cough up enough relocation grants"" #AmazonHQ2",Amazon HQ2- with opinion,Amazon HQ2- with opinion,Amazon HQ2- with opinion,1,Unsupportive,Unsupportive,Unclear,1,2017-09-14 16:56:43+00:00,0,0,1,0,"Boston, MA",17025706
LadyFilmFatale,,885,32581,"""The only way to deal with an unfree world is to become so absolutely free that your very existence is an act of rebellion."" - A. Camus",General Public,General Public,General Public,1,Personal,Personal,Personal,1,@ItsNotRevenge A letter to my representatives about #AmazonHQ2. https://t.co/E91Lq0AHay,Amazon HQ2- with opinion,Amazon HQ2- with opinion,Amazon HQ2- No opinion,1,,Unsupportive,Unclear,0,2019-03-01 21:19:26+00:00,1,0,2,0,Para8Dice@AOL.com,24106352
Mayor_1Percent,"*Parody account, how to handle",598,2326,"The economic royalists are fucking unanimous in their support for me, and I welcome their fucking support.
#Rahm2020
PARODY",General Public,General Public,General Public,1,Personal,Personal,Personal,1,$600M diverted into TIF funds is fucking unacceptable. I'm going to need at least four times that much to grease The Beeze and secure #AmazonHQ2.,Amazon HQ2- with opinion,Amazon HQ2- with opinion,Amazon HQ2- with opinion,1,Unsupportive,Balanced,Unsupportive,0,2018-07-25 17:36:38+00:00,1,0,3,0,Chicago Bunker,2800464699
spinzo,,922,70972,Brother of the Angle. Former U.S. Navy Intel. Bitter karaoke loser. Failure poet. O Sancta Simplicitas!,General Public,General Public,General Public,1,Personal,Personal,Personal,1,"When Amazon gets around to announcing the ""winning"" city, the only winners will be Amazon and a handful of pols and cronies. The losers will be the citizens of said city and the free market.

#HQ2
#AmazonHQ2",Amazon HQ2- with opinion,Amazon HQ2- with opinion,Amazon HQ2- with opinion,1,Unsupportive,Balanced,Unsupportive,0,2018-01-18 15:04:57+00:00,0,0,0,0,New England,19772792
ChrisL4mbert,,554,4577,REALTOR® w/ @Macdonald_Rlty Downtown Vancouver #RealProud | @BCIT Business alum | #WhitecapsFC supporter w/ @RainCityBrigade,Other Relevant Actors,Other Relevant Actors,Other Relevant Actors,1,Personal,Personal,Personal,1,Good article re: #AmazonHQ2 in #Vancouver - What Urban Anchors Like #Amazon &amp; #Google Owe Their Cities https://t.co/94LMKDb2js via @CityLab https://t.co/4bioQMfxgN,Amazon HQ2- with opinion,Amazon HQ2- with opinion,Amazon HQ2- with opinion,1,Unclear,Supportive,Unsupportive,0,2017-09-22 03:15:03+00:00,2,0,1,0,Vancouver,4440771988
electroverge,,313,1737,Electroverge is a transformational distribution partner bridging the gap between leading edge electronic component suppliers and the electronics ecosystem.,Business Account,Business Account,Business Account,1,Institutional,Institutional,Institutional,1,Viewpoint: Why #AmazonHQ2 is a bad idea for Boston https://t.co/Wp88EttEnN,Amazon HQ2- with opinion,Amazon HQ2- with opinion,Amazon HQ2- with opinion,1,Unsupportive,Unsupportive,Unsupportive,1,2018-01-25 00:35:03+00:00,0,0,0,0,"Boston, MA",9.26E+17
CWWatchUK,,221,154,"Investigating public support for private business and offering searchable databases of #corporatewelfare recipients, funding schemes and #lobbying.",Other Relevant Actors,Other Relevant Actors,Other Relevant Actors,1,Institutional,Institutional,Institutional,1,"What do you give the richest man in the world? If you're the state of Maryland, you give him $8.5bn. #corporatewelfare #amazon #amazonhq2 https://t.co/kyUDH4sQ3H",Amazon HQ2- with opinion,Amazon HQ2- with opinion,Amazon HQ2- with opinion,1,Unsupportive,Unsupportive,Unsupportive,1,2018-04-17 16:37:02+00:00,14,0,11,4,"York, England",8.62E+17
barmyFP,,270,12211,Very clever with maracas.,General Public,General Public,General Public,1,Personal,Personal,Personal,1,"Which is why New York told them to piss up a rope.

This isn't complicated. #AmazonHQ2 https://t.co/lve5d85zZH",Amazon HQ2- with opinion,Amazon HQ2- with opinion,Amazon HQ2- with opinion,1,Unsupportive,Unsupportive,Unsupportive,1,2019-03-06 18:17:09+00:00,0,0,0,0,"Allston - Brighton, Boston",12324562
helicoptershots,,281,9397,I work and partner with 🚀companies in 📻🎮🏗️. Make friends in 🏀⚾🏏. Make Have 🥑 in one hand & 🫖 in other.,General Public,General Public,General Public,1,Personal,Personal,Personal,1,"Each year, local governments spend nearly $100 billion to move headquarters and factories between states. It’s a wasteful exercise that requires a national solution.

Super Insightful By | @DKThomp of @TheAtlantic) https://t.co/5QrfDzucIZ

#AmazonHQ2",Amazon HQ2- with opinion,Amazon HQ2- with opinion,Amazon HQ2- with opinion,1,Unsupportive,Unsupportive,Unsupportive,1,2018-11-13 12:38:00+00:00,0,1,2,0,🇺🇲In the Mountains ,18295118
peachesforjesus,,18,636,,General Public,General Public,General Public,1,Personal,Personal,Personal,1,"@amazon don't move AmazonHQ2 to Austin, we're full",Amazon HQ2- with opinion,Amazon HQ2- with opinion,Amazon HQ2- with opinion,1,Unsupportive,Unsupportive,Unsupportive,1,2018-02-06 02:23:04+00:00,0,0,0,0,,151290298
SlimJim2123,,1416,403474,,General Public,General Public,General Public,1,Personal,Personal,Personal,1,@fox5dc #AmazonHQ2 ceo gets to be even richer while the tax payer fits the bill; how wonderful.  People wonder why the rich get richer and the poor stay poor.,Amazon HQ2- with opinion,Amazon HQ2- with opinion,Amazon HQ2- with opinion,1,Unsupportive,Unsupportive,Unsupportive,1,2018-11-13 17:50:44+00:00,0,0,0,0,,3389604502
yuval_id,,539,3013,"oversharing and underachieving | software engineer, feminism, rants, pop culture. she/her.",General Public,General Public,General Public,1,Personal,Personal,Personal,1,"Amazon making poorer cities pander to them and essentially beg them to come there only to choose NYC, a place that absolutely doesn’t need/want them, is one of the cruelest and most disgusting ways to go about gentrifying another community.
#AmazonHQ2 @amazon",Amazon HQ2- with opinion,Amazon HQ2- with opinion,Amazon HQ2- with opinion,1,Unsupportive,Unsupportive,Unsupportive,1,2018-11-15 16:15:52+00:00,0,0,0,0,"New York, NY",2732299034
StrayAdult,,232,16425,Sean | He/They | @UnsungOctopiPod host | Hockey | Rollerblading | #LGRW | Dog Dad |,General Public,General Public,Media,1,Personal,Personal,Personal,1,"Despite studies, reports, numerous economic development discussions, #AmazonHQ2 picks the 'safe' cities in the country to move to. Either way, entire massive cities bowing &amp; kissing the feet of Bezos is shameful. Serve your residents, not some capitalist shill. #ThursdayThoughts",Amazon HQ2- with opinion,Amazon HQ2- with opinion,Amazon HQ2- with opinion,1,Unsupportive,Unsupportive,Unsupportive,1,2018-01-18 20:27:58+00:00,0,1,0,0,Michigan,2612776994
papershadow,,1230,14133,"Word nerd + sci-fi geek🖖🏽 • Director, Media Relations and Issues Management @CBCRadioCanada • Board Director @AsiaCatalyst • Ex-@OpenSociety @HIVlegal",General Public,Media,Media,0,Personal,Personal,Personal,1,"Good &gt; “We’re not going to buy Amazon to come here."" // #AmazonHQ2 #topoli #onpoli https://t.co/ijTkfOqK0J",Amazon HQ2- with opinion,Amazon HQ2- with opinion,Amazon HQ2- with opinion,1,Unsupportive,Unsupportive,Unsupportive,1,2017-10-19 02:05:59+00:00,0,0,0,0,"Toronto, Ontario",31332452
FredAJones1,,192,4805,"Founder Director of Jones 2000, Executive Director, Community advocate,  writer, thinker, motivator, husband, father, honorary doctorate of Divinity.",General Public,General Public,Other Relevant Actors,1,Personal,Personal,Personal,1,@FOX4 so #AmazonHQ2 wants to improve it's carbon footprint by 2030🙄 really? You'd think that a company that pays no taxes could do better then that 🤬,Amazon HQ2- with opinion,Amazon HQ2- with opinion,Amazon HQ2- with opinion,1,Unsupportive,Unsupportive,Unsupportive,1,2019-02-18 23:22:47+00:00,0,0,0,0,,352874573
SloaneAirey,,2573,8023,DC journo. Words @dclinenews @ARLnowDOTcom @alxnow @WashTimesLocal @SentandEnt. she/her 🏳️‍🌈,Media,Media,Media,1,Personal,Personal,Personal,1,"36-yr old resident Crystal City Maha Hilal leads @dcmuslimjustice and told me the #forusnotamazon coalition opposes #AmazonHQ2 in Arl b/c of the ""threat of development, unemployment and shutting down local business, but also the threat of increased deportation and surveillance."" https://t.co/QVVW8eImjI",Amazon HQ2- No opinion,Amazon HQ2- with opinion,Amazon HQ2- with opinion,0,,Unsupportive,Unsupportive,0,2019-03-16 17:15:38+00:00,8,1,11,1,"Washington, DC",7.08E+17
EluvialInc,,37,290,Brokerage . Construction . Consulting,Business Account,Other Relevant Actors,Business Account,0,Institutional,Institutional,Institutional,1,"Did you know that Washington, DC made the list of 20 finalists being considered as the home to #AmazonHQ2? If selected, the DC Metro area can expect to see home prices rise as little as 1.8% or as much as 3.5%! #Amazon #DC #EluvialEnterprise #RealEstate https://t.co/qWiPvZpihB",Amazon HQ2- with opinion,Amazon HQ2- with opinion,Amazon HQ2- No opinion,1,Unclear,Balanced,,0,2018-10-31 20:19:18+00:00,0,0,1,0,"Washington, DC",7.91E+17
SuitesatMadison,,201,417,Creating Community in #DowntownTampa . Shared Office space and conference room rentals in the heart of the City. #legalservices #virtualOffice,Business Account,Other Relevant Actors,Other Relevant Actors,0,Institutional,Institutional,Institutional,1,#AmazonHQ2 https://t.co/Rzde8WTSBa,Amazon HQ2- No opinion,Amazon HQ2- with opinion,Amazon HQ2- No opinion,0,,Balanced,,0,2017-11-15 19:30:54+00:00,0,0,1,0,"Tampa, FL",9.03E+17
jf2good,,423,41106,Drill Baby Drill,General Public,General Public,General Public,1,Personal,Personal,Personal,1,Does #Amazon still want to move to the #AmazonHQ2 to #Atlanta after the #atlantapoweroutage hahaha This isn't the first fiasco the city has had.,Amazon HQ2- No opinion,Amazon HQ2- with opinion,Amazon HQ2- No opinion,0,,Balanced,,0,2017-12-18 14:08:18+00:00,0,0,0,0,Arkansas,53206359
ALLIEDTELECOM,,4360,5029,"Dependable business Internet, phone, and Unified Communications solutions delivered with award-winning support.",Business Account,Business Account,Business Account,1,Institutional,Institutional,Institutional,1,Welcome to the neighborhood @amazon! https://t.co/cbWL4UKhuZ #AmazonHQ2 #CrystalCity https://t.co/kAtBDzSfmU,Amazon HQ2- with opinion,Amazon HQ2- with opinion,Amazon HQ2- No opinion,1,Supportive,Supportive,,1,2018-11-13 17:15:23+00:00,0,0,0,0,"Washington Metro Area, MidAtlantic Region, Northeast Region",33977570
stateofplace,,3865,12606,"AI urban design data & predictive analytics software helping #citymakers create walkable, livable, equitable, sustainable places people CAN access & love.",Other Relevant Actors,Other Relevant Actors,Other Relevant Actors,1,Institutional,Institutional,Institutional,1,Congrats to the 20 final cities! #AmazonHQ2 https://t.co/EBQJ24JK1L,Amazon HQ2- with opinion,Amazon HQ2- with opinion,Amazon HQ2- No opinion,1,Supportive,Supportive,,1,2018-01-18 18:08:08+00:00,0,0,1,0,"Boston, NYC, Shanghai",539198528
adamecooper,,865,3703,"Director Human Resources at Aon, Ice Hockey Player, Video Gamer, Sci-fi and social media addict. Tweets are my views.",General Public,General Public,Other Relevant Actors,1,Personal,Personal,Personal,1,"Toronto made the list!

#amazonHQ2 https://t.co/X0QHJIR4jD",Amazon HQ2- with opinion,Amazon HQ2- with opinion,Amazon HQ2- No opinion,1,Supportive,Supportive,,1,2018-01-18 15:32:30+00:00,0,0,0,0,"Toronto, Ontario",18790165
GracieG6girl,,103,4327,Galatians 6 ll                                                                                           A Place Where Faith & Action Collide #GracieG6Girls,General Public,General Public,General Public,1,Personal,Personal,Personal,1,@Forbes @TerryMcAuliffe I think you did it. Congratulations !!!! You were an excellent governor on Virginia's business front. Thank you!  #AmazonHQ2 #VirginiaAmazonHQ2,Amazon HQ2- with opinion,Amazon HQ2- with opinion,Not about Amazon HQ2,1,Supportive,Supportive,,1,2018-11-13 12:47:22+00:00,0,0,0,0,East Coast,2794377876
AskaNewYorker,,3133,3999,https://t.co/mre7cb5gYD - perspectives and insight from the people of the greatest city in the world. Kennedy Moore Real Estate Agent  718 737 3990,Other Relevant Actors,Other Relevant Actors,Other Relevant Actors,1,Institutional,Personal,Institutional,0,Amazon on the East River https://t.co/XzcNvY8SSt #HappyThanksgiving #AmazonHQ2,Amazon HQ2- with opinion,Amazon HQ2- with opinion,Amazon HQ2- No opinion,1,Unclear,Supportive,,0,2018-11-21 16:33:21+00:00,0,0,0,0,New York City,10441712
OurTownDC,,342,2139,Asking yourself - What ever happened to  . . . ?  Find your FAV DC Metro “mover and shaker” in 4 Seasons of Our Town podcast interview with Andy Ockershausen.,Media,Media,Media,1,Institutional,Institutional,Institutional,1,Host Andy Ockershausen's guest in this new #OurTown podcast interview is @esmith_UA CEO of @UrbanAlliance  Smith leads her org to provide HS Seniors with internship opportunities and experiences they would not otherwise have. #AmazonHQ2 are you listening?  https://t.co/58JC9prCnT,Amazon HQ2- with opinion,Amazon HQ2- with opinion,Not about Amazon HQ2,1,Unclear,Supportive,,0,2019-01-29 20:50:53+00:00,4,0,4,1,"Washington, DC",7.55E+17
GoIveyGroup,,66,4748,"At the Ivey Group, we specialize in all aspects of Real Estate, making Buying, Selling, Renting & Property Management simple for everyone! Contact us today!",Other Relevant Actors,Other Relevant Actors,Other Relevant Actors,1,Institutional,Institutional,Institutional,1,"Watch: New video, website aimed to lure Amazon HQ2, new business to Detroit https://t.co/7tyWo6x9Uu https://t.co/MWPoc80zqO",Amazon HQ2- No opinion,Amazon HQ2- with opinion,Amazon HQ2- No opinion,0,,Supportive,,0,2017-10-19 15:11:06+00:00,0,0,0,0,Metro Detroit,2687901019
fabiantilmant,,2301,51191,"Freelance Innovation Product Manager ~ Currently @VRTsandbox and @Wemanity ~ ex @mpactbe Board ~ TMT+Retail Convergence, Media Disruption & Smart Mobility",General Public,General Public,Business Account,1,Personal,Personal,Personal,1,Wouldn’t it make sense to have #AmazonHQ2 in Asia?,Amazon HQ2- No opinion,Amazon HQ2- with opinion,Amazon HQ2- No opinion,0,,Supportive,,0,2017-10-19 15:25:40+00:00,0,0,0,0,"Brussels, BE",25490135
nanderoo,,1266,19086,"Interested in Predictive Analytics and Machine Learning. 20+ years experience in software development. Tweets are my own, not my employers.",General Public,Other Relevant Actors,General Public,0,Personal,Personal,Personal,1,Could #Baltimore and #Maryland be in the running? Plenty of space at #SparrowsPoint? #amazonhq2 #amazon #hq2 /cc @LarryHogan @MayorPugh50 https://t.co/L2vvMRw9qs,Amazon HQ2- with opinion,Amazon HQ2- with opinion,Amazon HQ2- No opinion,1,,Supportive,,0,2017-09-07 13:18:50+00:00,1,1,1,0,"Pasadena, MD",39574483
WCAX_Jack,,1313,21530,"Sports Director for @WCAX, formerly WBOY. UVa '13/Cuse '14. One time ""Fan of the Game"" at RFK. Led my 2nd grade baseball league in hit by pitches.",General Public,Media,Media,0,Personal,Personal,Personal,1,"I love how there's 15 individual cities, two in the NYC area...and then THREE finalists in the DC metro. Seems to me like one of those is the favorite.
#AmazonHQ2 https://t.co/P9fZZBXIBW",Amazon HQ2- with opinion,Amazon HQ2- with opinion,Amazon HQ2- No opinion,1,Unclear,Unclear,,1,2018-01-18 19:11:51+00:00,0,0,1,0,"Burlington, VT",403123390
DickYoungsGhost,,2731,319553,"The modern voice of one of the greatest sportswriters, ever. ""Dick Young was exactly what a tabloid sportswriter was supposed to be like"" - Frank Deford.",Media,General Public,General Public,0,Institutional,Personal,Personal,0,@Pdzielinski @Peggynoonannyc @JimmyVanBramer Jimmy Van Two Faces! Fighting for (drag) Queens! #AmazonHQ2,Amazon HQ2- with opinion,Amazon HQ2- with opinion,Not about Amazon HQ2,1,Unclear,Unclear,,1,2019-02-24 16:06:16+00:00,0,0,0,0,My America,417516965
jeremyhobson,,19602,18736,"Host of The Hobcast, lover of adventure, learning, conversation, music, food and nature. Former host at @NPR's @hereandnow and @Marketplace.",Media,Media,Media,1,Personal,Personal,Personal,1,"New #AmazonHQ2 prediction, in descending order: Pittsburgh, Baltimore, Philadelphia, Toronto, Chicago and Boston. https://t.co/HXh7s8FCoQ",Amazon HQ2- No opinion,Amazon HQ2- with opinion,Amazon HQ2- No opinion,0,,,,0,2017-10-27 11:04:12+00:00,2,1,6,1,,198686176
SciConservative,,344,18869,"🇺🇸  | Biology Student 🔬 | Classical Liberal 🏛️ | Substantiated counter-arguments are encouraged | Intrigued by Political, Legal, and Moral Philosophy",General Public,General Public,General Public,1,Personal,Personal,Personal,1,"""What's shocking to me is once again she shows how little she understands not just economics but even unemployment.""

.@JoeNBC is absolutely correct. At this point, @AOC's economic illiteracy is incontrovertible. 

#FridayThoughts
#AmazonHQ2
#AOC https://t.co/to9MJKnboE",Amazon HQ2- with opinion,Amazon HQ2- with opinion,Not about Amazon HQ2,1,Supportive,Unsupportive,,0,2019-02-15 14:55:14+00:00,1,0,1,0,"Texas, USA",8.91E+17
graemeknows,,5748,86614,"Events, Experiences, & Content @IBM🐝 President, Historian, & Social Media @CampTakodah🕯 @BridgeStateU grad 🐻 #WeeksEnd Co-Host 📹 Elections Inspector 🗳",General Public,General Public,Knowledge Workers,1,Personal,Personal,Personal,1,"Deep within a secret lair, a meeting falls silent as Bezos speaks up. ""They put YES on the cover. That's all we need to know."" #AmazonHQ2 https://t.co/BOBbsAzY5T",Amazon HQ2- with opinion,Amazon HQ2- with opinion,Amazon HQ2- No opinion,1,Unclear,Unsupportive,,0,2017-10-20 12:54:09+00:00,0,1,0,0,Virgo Supercluster,237413764
mdevitojr,,4687,5238,A Human Being - being a Writer-Teacher-Mediator-Meditator-#Runner-Dad-Husband-#Marine #CreateFlow #Workforce #WeImproveLives @NYCID #LetsRunTogether #CountmeIn,General Public,General Public,General Public,1,Personal,Personal,Personal,1,"So how about all the people who shook the rafters about #AmazonHQ2 come on out and do for #Local3...

It's been 690 day!

Anyone? 

#CountMeIn
#CorporateGreed
#spectrumstrike
#IWantMylocal3 https://t.co/uBHeowSkOM",Amazon HQ2- with opinion,Amazon HQ2- with opinion,Amazon HQ2- No opinion,1,Unsupportive,Unsupportive,,1,2019-02-15 19:35:18+00:00,14,1,16,0,"Staten Island, NY",8.32E+17
NYSenatorRivera,,14654,16279,"Cleaning up the legislature and ensuring that the families of the 33rd Senate District have a voice in Albany. Chair, Senate Health Committee. (he/him)",Politicians/Government Accounts,Politicians/Government Accounts,Politicians/Government Accounts,0,Personal,Personal,Personal,1,My statement on the #AmazonHQ2 deal. https://t.co/IrNaQEluoR,Amazon HQ2- with opinion,Amazon HQ2- with opinion,Amazon HQ2- No opinion,1,Unsupportive,Unsupportive,,1,2018-11-21 19:17:43+00:00,1,1,2,1,"Bronx, NY",148524657
rhayes1121,,94,1356,"Art V Propaganda - Life and times of ME
😀www. https://t.co/zCTKO1MNut
Diversity and Small business from across the Globe",Business Account,General Public,General Public,0,Institutional,Personal,Personal,0,Is starting a business in one of #Amazon 2d HQ short list a good idea? https://t.co/qs2Qma1g2A via @gdnnetwork #SmallBusinessNews #AmazonHQ2 #Entrepreneur,Amazon HQ2- No opinion,Amazon HQ2- with opinion,Amazon HQ2- No opinion,0,,Unsupportive,,0,2018-05-08 17:05:57+00:00,0,0,0,0,"Chicago, IL",547774091
aaruiz07,,256,16557,"Wanderlust✈️43+||pizza 😋|👟👟 salt & pepper|Bloomberg Terminal User, EN/ES/BP Graduate. Next stop 📍🌏✈",General Public,General Public,General Public,1,Personal,Personal,Personal,1,"Top 3 for #AmazonHQ2 :

1. Austin TX
2. Atlanta GA
3. Rochester NY

Then...
895. San Juan PR https://t.co/GmAIv9d6GU",Amazon HQ2- No opinion,Amazon HQ2- with opinion,Amazon HQ2- No opinion,0,,Unsupportive,,0,2017-10-24 17:59:35+00:00,1,0,1,1,"Rio Grande, P.R.",442667595
JoshDavidson,,882,5379,Writing on the interplay of food & communication.,General Public,General Public,Media,1,Personal,Personal,Personal,1,"Yeah, and DON'T GET ANY IDEAS EITHER, TORONTO. #5billionUSDis6billionCAD. https://t.co/QgQCY5UMVR #AmazonHQ2 https://t.co/AJeG0cwH6C",Amazon HQ2- No opinion,Amazon HQ2- with opinion,Amazon HQ2- No opinion,0,,Unsupportive,,0,2018-01-18 18:25:11+00:00,0,0,1,0,"Giligenteng, Indonesia",57714568
breeganism,,1558,63996,Washed-up French horn child prodigy. She/they/yoooooo! Host of @peakshowpod. The cutest ugly person you know.,General Public,General Public,Media,1,Personal,Personal,Personal,1,"If #AmazonHQ2 comes to Toronto I'm just going to bang on its doors yelling ""GET. BETTER. SVOD. CONTENT. GET. BETTER. SVOD. CONTENT."" until the Starbucks manager comes out of the building and informs me that I'm nowhere near the Amazon building and I should really put pants on.",Amazon HQ2- with opinion,Not about Amazon HQ2,Amazon HQ2- with opinion,0,Unclear,,Unclear,1,2018-01-18 15:34:34+00:00,1,0,1,0,Tobacco country,28624695
bezostown,,546,8512,"Creator of Bezostownbucks paper currency. This account ends July 5, 2021 new Twitter will be: @wildworldnews",Bot,General Public,General Public,0,Bot,Institutional,Personal,0,"We’ve got Trump’s pee tape ... Amazon workers whizzing in bottles.

We are in a golden age of urine.

#pee #trump #amazon #AmazonHQ2",Not about Amazon HQ2,Not about Amazon HQ2,Amazon (Not HQ2),1,,,Unsupportive,,2019-03-01 16:17:04+00:00,1,0,1,0,"Seattle, WA",8.53E+17
RWwatchMA,,10445,382186,"First they came for the immigrants, and I did not speak out—because I was not an immigrants. Then they came for the judges",General Public,General Public,General Public,1,Personal,Personal,Personal,1,"Red Line riders need a moment of zen.. https://t.co/V6q9VSOo2X #AmazonHQ2 #bospoli

Marty Walsh: ""T is reliable"" https://t.co/E460xFQh9B",Amazon HQ2- No opinion,Not about Amazon HQ2,Amazon HQ2- No opinion,0,,,,0,2017-09-25 16:05:55+00:00,1,1,1,0,Massachusetts,245689692
lash_veira,,1,404,,Bot,Business Account,Bot,2,Bot,Institutional,Personal,2,"#AmazonHQ2
#Entrepreneur #expert #idea What If People Would Actually Pay You For Your Advice? Get Your FREE Copy Of EXPERT SECRETS Now...
https://t.co/dzKWcmLGlb https://t.co/PC3PI0OXhW",Not about Amazon HQ2,Not about Amazon HQ2,Not about Amazon HQ2,1,,,,,2018-01-19 06:39:15+00:00,0,0,0,0,,8.90E+17
